country,region,city,country_slug,region_slug,city_slug,timezone,last_verified,source_title,source_url,complaint_channel,complaint_url,fine_range,notes_admin,service_type,schedule_pattern,request_url,eligible_items,not_accepted_items,limits,fees,holiday_shifts,illegal_dumping_reporting,notes_public
CA,Ontario,Markham,canada,ontario,markham,America/Toronto,2025-10-16,"City of Markham - Furniture and Bulky Items",https://www.markham.ca/neighbourhood-services/recycling-garbage/furniture-bulky-items,"Access Markham Contact Centre",https://www.markham.ca/services/report-a-problem,"Penalties vary under municipal bylaws and may include fines for improper set-outs.","Bulky items are collected every other week on clear bag garbage days with a three-item limit. Appliances and large metal items are collected monthly by appointment with fees for appliances.",mixed,"Bulky items: every other week on clear bag garbage day; set out by 7:00 a.m. Appliances and large metal items: monthly by appointment.",https://www.markham.ca/neighbourhood-services/recycling-garbage/what-goes-where/collection-schedules,"Sofas and couches|Chairs|Mattresses and box springs|Toilets with separated components for two-piece units|Bundled wood up to 1.2 meters long and 18 kilograms|Rolled carpet tied within size and weight limits","Large appliances set out without an appointment|Large metal items without an appointment|Construction or renovation materials|Electronics|Household hazardous waste|Propane tanks","Three bulky items per collection. Wood bundles and carpet rolls must be tied, under 1.2 meters long, and weigh less than 18 kilograms. Apartment and condo residents must work with property managers.","Bulky collection is included in service. Appliance pickup costs $18.50 per appliance starting January 2025. Large metal item pickup is free. Drop-off facilities may charge fees depending on materials.","If a statutory holiday falls between Tuesday and Friday, collection shifts one day later. Check the collection schedule for updates.",https://www.markham.ca/services/report-a-problem,"Set bulky items out by 7 a.m. on clear bag garbage weeks with a three-item limit. Schedule monthly appliance or metal pickups and remove fridge or freezer doors before collection. Use depots for renovation debris, electronics, or hazardous waste."
US,California,San Diego,united-states,california,san-diego,America/Los_Angeles,2025-10-16,"City of San Diego - Recycling Mattresses and Box Springs",https://www.sandiego.gov/environmental-services/recycling/residential/mattresses,"Environmental Services Department Customer Service 858-694-7000 (Monday-Friday 6:30 a.m.-5:00 p.m.); Get It Done app or web portal; after-hours illegal dumping call San Diego Police Department non-emergency 619-531-2000",https://getitdone.sandiego.gov,Varies by violation,"The City does not provide bulky curbside pickup. Mattress and box spring disposal is handled through a free drop-off program. Guidance confirmed through Environmental Services Department resources including the 2025 curbside guide, Miramar Landfill fee schedule, and illegal dumping information.",dropoff,"No routine curbside bulky collection or appointments. The mattress drop-off site outside Miramar Landfill is open Monday-Friday 7:00 a.m.-3:00 p.m. and closed weekends and on City-observed holidays. Weekly trash service shifts one day later during holiday weeks.",,"Mattresses delivered to the City's mattress collection site outside Miramar Landfill|Box springs delivered to the City's mattress collection site|Other bulky items must be taken to Miramar Landfill, private haulers, or locations listed on WasteFreeSD.org","Any curbside placement of bulky items for City collection|Household hazardous waste, electronics, batteries, light bulbs, paint, motor oil, or chemicals|Mattresses that are wet, soiled, infested with bedbugs, severely damaged, twisted, or frozen","No curbside bulky service. Mattress drop-off has no published item limit but materials must meet condition requirements and be self-hauled by residents during posted hours. Miramar Landfill loads must be covered and comply with landfill restrictions.","Mattress and box spring drop-off is free through the Mattress Recycling Council. Miramar Landfill charges flat-rate disposal fees by vehicle type and applies a $50 uncovered load fee; weighed loads may require a deposit.","No collection on New Year's Day, Memorial Day, Independence Day, Labor Day, Thanksgiving Day, or Christmas Day; curbside trash, recycling, and organics shift one day later for the rest of the week.","Report via the City's Get It Done portal or call Environmental Services at 858-694-7000 during business hours; after hours call the San Diego Police Department non-emergency line at 619-531-2000 or 911 in an emergency.","City-serviced homes do not receive bulky curbside pickup. Use the free mattress drop-off outside Miramar Landfill or haul other bulky items to Miramar, a private hauler, or a recycling option listed on WasteFreeSD.org. Do not place bulky items at the curb; illegal dumping is subject to enforcement. Confirm your service provider and holiday schedule through the City's lookup tool."
US,New York,New York,united-states,new-york,new-york,America/New_York,2025-10-16,"NYC Department of Sanitation - Large Items (Bulk)",https://www.nyc.gov/site/dsny/collection/get-rid-of/large-items.page,"Report missed collection through NYC 311 online, the 311 app, or by calling 311 (212-NEW-YORK outside NYC)",https://on.nyc.gov/MissedTrash,"Illegal dumping civil penalties range from $4,000 to $18,000 with possible vehicle impoundment. Mattresses or box springs not sealed in plastic bags may incur fines up to $300. Residential set-out violations range from $50 to $200 depending on repeat offenses.","DSNY collects bulk curbside without appointments; up to six items may be set out per collection day. Metal and rigid plastic bulk is collected with recycling, while other items go out with trash. Mattresses must be bagged and electronics are banned from curbside disposal. Appliances containing CFCs require a free DSNY appointment.",mixed,"Set out up to six bulk items between 6:00 p.m. and midnight the evening before your scheduled collection day. Place metal and rigid plastic items with recycling and other bulk with trash on the trash-only day. Schedule a free DSNY appointment before setting out CFC appliances; the item is tagged for pickup on the next recycling day after refrigerant removal.",https://www.nyc.gov/assets/dsny/forms/cfc-recovery-appointment-request,"Large furniture such as sofas, tables, desks, dressers, and bookcases|Wood furniture set out with trash on the trash-only day|Metal and rigid plastic items such as bed frames and file cabinets set out with recycling|Mattresses and box springs sealed in plastic bags|Rugs and carpets rolled and securely tied for trash day|Non-refrigerant appliances such as stoves, ovens, and washers set out with recycling|Refrigerators, freezers, air conditioners, dehumidifiers, and water coolers after DSNY removes CFCs","Electronics including televisions, computers, and printers covered by New York State e-waste law|Household hazardous waste such as paints, solvents, and pesticides|Construction and demolition debris including concrete, bricks, drywall, and large lumber loads|Gas cylinders, propane tanks, and fire extinguishers|Oversized or commercial appliances that cannot fit in a collection truck|Appliances using refrigerants not serviced by DSNY such as R600a or R32 units","Set out no more than six bulk items per collection day within the 6:00 p.m.-midnight window. Mattresses and box springs must be sealed in plastic bags. Roll and tie rugs. Keep items on the curb in front of your property without blocking sidewalks or driveways. Electronics cannot be placed at the curb and require e-waste disposal programs. Refrigerant appliances require DSNY appointments and door removal.","There is no fee for curbside bulk collection or for DSNY CFC removal appointments.","Collection is suspended on DSNY-recognized holidays. When service is suspended, set items out after 6:00 p.m. the evening before the next scheduled collection day and check the DSNY holiday schedule for alerts.","Report illegal dumping through NYC 311 online, the 311 app, or by calling 311. Call 911 if dumping is in progress. Vehicle owners may face fines from $4,000 to $18,000 and vehicle impoundment.","Bulk pickup in New York City is free and does not require an appointment for most items. Set out up to six items between 6:00 p.m. and midnight, bag mattresses, separate metal and rigid plastic for recycling, and schedule appointments for CFC appliances. Do not set electronics or hazardous waste at the curb."
CA,Ontario,Toronto,canada,ontario,toronto,America/Toronto,2025-10-16,"City of Toronto - Oversized and Metal Items",https://www.toronto.ca/services-payments/recycling-organics-garbage/houses/oversized-metal-items/,"311 Toronto",https://www.toronto.ca/home/311-toronto-at-your-service/create-a-service-request/,Varies by violation,"Oversized items are collected on regular garbage day without appointments and with no item limits. Residents pay an annual Oversized and Metal Items fee that supports the service. Preparation standards require 0.5 meter spacing, appliance door removal, and secure bundling.",curbside,"Set oversized items beside your garbage bin on the scheduled garbage collection day, leaving at least 0.5 meters (2 feet) of clearance around bins and items.",https://www.toronto.ca/services-payments/recycling-organics-garbage/houses/collection-schedule/,"Furniture such as tables, sofas, lamps, and patio furniture|Mattresses and box springs|Metal items and appliances with doors removed|Carpets that are rolled, cut, tied, no longer than 4 feet, and no heavier than 20 kilograms","Household hazardous waste including paint, pesticides, and batteries|Construction or renovation debris such as drywall, lumber, and tiles|Tires","There is no limit to the number of oversized items. Maintain 0.5 meters of spacing around bins and items, dismantle large or heavy pieces as needed, and follow special preparation rules for glass or bed bug infested items.","Service is funded through the annual Oversized and Metal Items fee ($22.39 per home in 2025); there is no per-item curbside charge.","Some holiday weeks shift collection by one day; confirm using the City's collection schedule or holiday pages.","Report dumping or litter issues through the City's bylaw enforcement portal at https://www.toronto.ca/city-government/public-notices-bylaws/bylaw-enforcement/litter-garbage/","Place oversized items beside your garbage bin with spacing, remove appliance doors, wrap bed bug infested items, and take household hazardous waste or renovation debris to a Drop-Off Depot. Check your collection day online."
CA,Manitoba,Winnipeg,canada,manitoba,winnipeg,America/Winnipeg,2025-10-16,"City of Winnipeg - Extra Garbage and Large Item Pickup",https://www.winnipeg.ca/services-programs/recycling-garbage/collection-services/extra-garbage-large-item-pickup,"Winnipeg 311",https://www.winnipeg.ca/311-city-services/submit-report-or-request,Varies by violation,"Large items are collected by appointment. Requests must be submitted at least two full business days before the regular collection day. Limits and fees follow the City's published guidance.",appointment,"Request pickup through the City portal at least two full business days before your regular collection day. The City confirms the collection date for your items.",https://myutility.winnipeg.ca/UtilityPortal/contactForm?section=special,"Large appliances|Furniture|Refrigerators or freezers (ozone-depleting substance handling fee applies)|Air conditioners|Extra garbage bags (fee per bag)","Household hazardous waste (use 4R Winnipeg Depots)|Construction, renovation, or demolition debris","Up to three extra garbage bags or up to ten large items per pickup. Typical maximum item size is 1.5 meters by 1.5 meters by 2.15 meters and weight up to 34 kilograms, except for appliances. Items must be set out after the appointment is confirmed.","Fees apply and are billed to the utility account, including charges for extra bags, appliances, and items containing ozone-depleting substances.","Collection may shift on weeks with City holidays; check your schedule for updates.","Report illegal dumping or property standards issues through https://www.winnipeg.ca/services-programs/bylaws-enforcement/property-neighbourhood-standards","Schedule appointments before setting items out. Set items out only after confirmation, and use 4R Winnipeg Depots for hazardous waste or materials not accepted at the curb. Contact 311 for missed pickups or dumping concerns."
US,Pennsylvania,Philadelphia,united-states,pennsylvania,philadelphia,America/New_York,2025-10-16,"City of Philadelphia - Schedule Trash Collection for Bulky Household Items",https://www.phila.gov/services/trash-recycling-city-upkeep/schedule-trash-collection-for-bulky-household-items/,"Philly311",https://www.phila.gov/311,Varies by violation,"The City offers free bulk pickup appointments for one-to-six unit properties. Up to four items can be scheduled per appointment, and items must be labeled with a pickup code. Regular trash day rules still allow two non-metal bulky items.",appointment,"Schedule appointments online or via 311. Set items at the regular collection point after 7:00 p.m. (5:00 p.m. in fall and winter) the evening before pickup and by 7:00 a.m. on the day of service. Label items with the four-letter pickup code.",https://bulkcollection.phila.gov,"Refrigerators and major appliances with doors removed|Household furniture|Large toys|Flat-screen televisions|Passenger vehicle tires without rims (four tires count as one item)","Household trash|Mattresses (set out on regular trash day and wrapped in plastic)|Hazardous, flammable, or explosive materials|Automotive parts|Construction or demolition debris","Up to four items per appointment; City crews will not enter homes. Items must display the pickup code and be set at the regular collection point. Sanitation Convenience Centers accept additional metal items.","There is no fee for City bulk appointments.","No trash or recycling collection on City holidays; collection runs one day late for the rest of the week.","Report illegal dumping through https://www.phila.gov/services/trash-recycling-city-upkeep/report-a-problem-with-trash-recycling-or-city-upkeep/report-illegal-dumping/","Book bulk appointments online or through 311, follow set-out times, label items with the pickup code, and use Sanitation Convenience Centers or household hazardous waste events for items not accepted in the bulk program."
