country,region,city,country_slug,region_slug,city_slug,timezone,last_verified,source_title,source_url,complaint_channel,complaint_url,fine_range,notes_admin,service_type,schedule_pattern,request_url,eligible_items,not_accepted_items,limits,fees,holiday_shifts,illegal_dumping_reporting,notes_public
US,Florida,Jacksonville,united-states,florida,jacksonville,America/New_York,2025-10-16,"City of Jacksonville - Household Bulk Collections",https://www.jacksonville.gov/departments/office-of-administrative-services/solid-waste/household-bulk-collection,"630-CITY (MyJax)",https://myjax.custhelp.com/,"Varies by violation; illegal dumping complaints are submitted through MyJax.","Bulk collection rules verified against City of Jacksonville guidance. Most areas receive curbside service without appointments, but appliances and tires require booking through MyJax. Automated collection areas accept limited DIY construction debris every other week.",mixed,"Place items at the curb by 6:00 a.m. on your area's bulk collection day. Consult the address-specific schedule. Appliances and tires are scheduled through MyJax; other eligible materials follow the area's routine service.",https://myjax.custhelp.com/,"Furniture such as mattresses, sofas, chairs, and grills|Glass that is wrapped and taped|Rolled carpet and padding up to 5 feet long|Bundled fencing with wood sections cut to 5 feet|Treated or painted wood cut to 6 feet|Small DIY construction debris in automated service areas on alternating weeks","Household hazardous waste|Contractor-generated construction or demolition debris|Yard waste mixed with bulk piles|Unwrapped glass or oversize pieces exceeding published limits","Keep piles within 5 feet of the curb. Most materials must be cut to 5 feet or less (treated or painted wood may be up to 6 feet). Bulk day frequency varies by service area. Small DIY construction debris is collected only in automated areas; contractors must remove their own debris.","Included with residential solid waste service. Appointments through MyJax cover appliances and tire pickups.","Collections adjust only for Thanksgiving Day and Christmas Day; New Year's Day follows a normal schedule. Check annual notices for details.",https://www.jacksonville.gov/departments/neighborhoods/neighborhood-blight/how-you-can-help,"Confirm your bulk collection day, set items out by 6 a.m., and schedule appliance or tire pickups through MyJax. Wrap glass, bundle fencing, and cut oversized pieces to the required lengths. Keep contractor debris, hazardous waste, and mixed yard waste out of the pile."
US,Oklahoma,Oklahoma City,united-states,oklahoma,oklahoma-city,America/Chicago,2025-10-16,"City of Oklahoma City - Bulky Waste",https://www.okc.gov/Services/Water-Trash-Recycling/Bulky-Waste,"OKC Utilities Customer Service",https://okcutilities.com/,"Varies by violation; early set-outs may receive citations, and illegal dumping is reported through the Action Center.","Monthly bulky program confirmed through OKC Utilities documentation. Residents receive a three-day pickup window beginning the first Monday each month. The first 4 cubic yards are included; additional volumes incur fees.",curbside,"Set items out by 6:00 a.m. on the assigned monthly set-out day with a three-day collection window. Do not set materials out earlier than three days prior to the assigned day.",https://www.okc.gov/Services/Water-Trash-Recycling/Trash-Services/My-Trash-Day,"Large and small household appliances (coordinate refrigerant removal with Utilities)|Furniture and carpeting|Fencing|Small amounts of DIY home-repair debris|Tree limbs from resident maintenance up to 10 feet long|Glass or mirrors that are wrapped and secured","Bagged landscape waste|Contractor-generated debris|Bricks, concrete, or rocks|Automotive parts, oils, or fuels|Paints, solvents, or pesticides|Batteries and other hazardous materials","The first 4 cubic yards per pickup are included in base service. Additional fees apply for 4 to 10 cubic yards; piles over 10 cubic yards require pre-approval. Maintain at least 5 feet of clearance from obstacles and avoid setting out more than three days in advance.","Standard service covers up to 4 cubic yards. The City charges excess bulky fees for larger piles; rates are published annually (for example, $13.86 for excess service as of January 2025).","Bulky waste operations continue on the regular schedule and are not affected by holidays.",https://www.okc.gov/Services/Action-Center/Report,"Review your monthly set-out calendar, place items curbside by 6 a.m., avoid bagging yard debris, and keep piles under 4 cubic yards to avoid extra charges. Call Utilities Customer Service for refrigerant appliances."
US,Wisconsin,Milwaukee,united-states,wisconsin,milwaukee,America/Chicago,2025-10-16,"City of Milwaukee - Bulky Item Pickup Guidelines",https://city.milwaukee.gov/sanitation/Bulky-Item-Pickup,"Unified Call Center (Click for Action / 414-286-CITY)",https://milwaukee.gov/click4action,"Illegal dumping fines can reach $5,000 under Department of Neighborhood Services enforcement.","Milwaukee provides limited curbside bulky service with a one cubic yard allowance on garbage day. Larger volumes require paid Special Pickup requests. Yard waste, electronics, appliances, and tires have separate programs.",mixed,"Place up to one cubic yard of bulky waste at the regular collection point on garbage day. Submit a Special Pickup request for larger loads and follow the scheduled set-out instructions.",https://iframe.publicstuff.com/,"Broken furniture|Mattresses and box springs|Large broken toys|Small amounts of carpet cut to manageable sizes|Other household bulky items that do not fit in the garbage cart","Yard waste except during Project Clean & Green events|Electronics and televisions|Appliances|Tires|Construction and demolition debris","Standard service includes up to one cubic yard per week. Special Pickups cost $50 for one to four cubic yards and $150 for four to six cubic yards; volumes over six cubic yards are not eligible and may incur enforcement action.","One cubic yard is included with regular collection. Special Pickups require payment ($50 for one to four cubic yards; $150 for four to six cubic yards). Drop-off centers may charge additional fees.","Collection schedules may shift on weeks that include City holidays; check the address-specific schedule.",https://city.milwaukee.gov/DNSPrograms/Dumping,"Set out one cubic yard or less on your garbage day without a request. For larger loads, schedule a paid Special Pickup and follow drop-off center guidelines for electronics, appliances, tires, yard waste, and construction debris."
US,Louisiana,New Orleans,united-states,louisiana,new-orleans,America/Chicago,2025-10-16,"City of New Orleans - Trash Collection (Bulky Waste)",https://nola.gov/trash/,"NOLA 311 (dial 311 or 504-539-3266) or the MyNOLA portal",https://nola311.org/,"Varies by violation; City Code Section 138-42 governs set-out timing and penalties.","Bulky service in New Orleans requires a request through NOLA 311. Residents of eligible small properties can schedule pickups for furniture, appliances, limited yard waste, and tires. Set-out timing is strictly regulated.",appointment,"Submit a bulky item request via NOLA 311. Place items curbside no earlier than 24 hours before the scheduled collection day and by early morning on the regular solid waste collection day.",https://nola311.org/request-types/,"White goods and appliances such as refrigerators and washers|Furniture and mattresses|Carpet rolled and tied under four feet|Up to six bags of yard waste (bagged leaves, grass, or clippings up to 50 pounds each)|Up to six bundles of branches (each bundle under four feet long and 12 inches in diameter, up to 50 pounds)|Up to four tires","Household hazardous waste including batteries, fluorescent bulbs, and chemicals|Electronics and televisions|Construction and demolition debris|Waste generated by businesses or properties with more than four units|Set-outs exceeding allowed quantities or placed out more than 24 hours early","Service is available to residential properties with four units or fewer. Follow set-out timing rules, limit yard waste to six bags and six bundles, and limit tires to four. Carpet must be rolled and tied under four feet.","Included with City residential solid waste service for eligible properties; no separate fee for scheduled bulky pickups.","In most neighborhoods, collection is suspended on New Year's Day, Mardi Gras Day, Thanksgiving Day, and Christmas Day. During these weeks, pickup shifts one day later. French Quarter and Downtown Development District receive daily trash collection with some holiday exceptions.",https://www.nola.gov/sanitation/code-enforcement/illegal-dumping/,"Request bulky pickup through NOLA 311, then set items out no more than 24 hours before your collection day. Accepted materials include appliances, furniture, small batches of yard waste, and up to four tires. Keep hazardous waste, electronics, and construction debris out of the pile."
CA,Ontario,Mississauga,canada,ontario,mississauga,America/Toronto,2025-10-16,"Region of Peel - Bulky Items",https://peelregion.ca/waste/garbage/bulky,"Region of Peel Waste Management (Waste Not Picked Up) at 905-791-7800 or online",https://peelregion.ca/services/waste-not-picked,"Illegal dumping fines range from $500 up to $100,000 under local bylaws.","Bulky items are collected on regular garbage day without appointments. Large appliances and electronics are handled through Community Recycling Centres. Item preparation rules confirmed through Peel Region guidance.",curbside,"Set bulky items at the curb by 7:00 a.m. on your regular garbage collection day. No appointment is required; follow item-specific preparation rules.",https://peelregion.ca/waste/waste-collection-schedules/collection-calendar,"Furniture such as sofas, chairs, tables, and dressers|Mattresses and box springs|Barbecues without propane tanks|Rolled carpet or underlay cut and bundled within size limits|Ceramic toilets (maximum two with the tank removed and placed separately)","Electronics including televisions and computers|Large appliances and metal fixtures such as refrigerators, freezers, or water heaters|Propane tanks or cylinders|Household hazardous waste including paint, solvents, and automotive fluids|Construction and renovation debris beyond allowed preparation","Cut and roll carpet to a maximum of 1.2 meters long and 76 centimeters wide. Toilets are limited to two per pickup and must have tanks removed. Remove propane tanks from barbecues and place items at the curb without blocking access.","Curbside bulky pickup is free. Community Recycling Centre drop-off fees apply for certain materials, with dedicated loads of metals, electronics, and appliances accepted at no charge.","No collection on major holidays such as Family Day, Good Friday, Victoria Day, Canada Day, Civic Holiday, Labour Day, Thanksgiving, Christmas, Boxing Day, and New Year's Day. During holiday weeks, collection is delayed, typically one day later. Check the Collection Calendar for specifics.",https://peelregion.ca/services/waste-collection-bylaw/enforcement.asp,"Mississauga curbside bulky service is handled by the Region of Peel. Set eligible items out by 7 a.m. on your garbage day, bundle carpets within size limits, remove propane tanks from barbecues, and take appliances or electronics to a Community Recycling Centre."
CA,Ontario,Windsor,canada,ontario,windsor,America/Toronto,2025-10-16,"City of Windsor - Residential Bulk Furniture Collection",https://www.citywindsor.ca/residents/waste-and-recycling/residential-bulk-furniture-collection,"Call 311 or 519-255-CITY (2489); Windsor 311 online and mobile app available",https://windsor-cwiprod.motorolasolutions.com,Varies by violation; illegal dumping may be referred to Windsor Police Service.,"Windsor limits residential bulk service to furniture, requiring paid appointments through 311. Guidelines include two items per booking, weight and size limits, and preparation requirements.",appointment,"Book through 311. Each collection zone has two dates per month. Set items at the curb (no alleys) after 7:00 p.m. the night before and before 6:00 a.m. on pickup day.",https://www.citywindsor.ca/city-hall/customer-service/311,"Mattresses and box springs|Couches, sofas, and sectionals|Sofa beds with mechanisms tied shut|Recliner chairs secured closed|Dressers and cabinets emptied with drawers removed|Kitchen tables, chairs, and non-metal desks|Bathroom vanities without porcelain components","Electronics or e-waste|Metal items|Bagged materials|Kitchen appliances such as refrigerators or stoves|Washers and dryers|Loose renovation debris|Glass or mirrors (set with regular garbage when boxed and labeled)|Concrete, pallets, yard waste, or tires|Items with compressors or refrigerants|Liquids, hazardous waste, explosives, or medical waste","Maximum of two items per booking. Each item must weigh 200 pounds or less, measure no more than 1.2 meters wide and 2.4 meters long, and be manageable for a two-person crew. Payment is required by the Friday preceding pickup.","Bulk furniture pickup costs $12.50 per item (tax included). Drop-off alternatives are available at the EWSWA Public Drop Off Depot, with fees varying by material.","Collections adjust around City-observed statutory holidays. Drop-off depots close on Sundays and most holidays; confirm dates when booking appointments.",https://www.citywindsor.ca/residents/waste-and-recycling/Pages/Litter-Control.aspx,"Windsor's curbside bulk program is for furniture only. Schedule through 311, pay in advance, tie mechanisms shut, remove drawers, and keep items within weight and size limits. Take appliances, metals, electronics, and hazardous waste to drop-off facilities."
CA,Nova Scotia,Halifax,canada,nova-scotia,halifax,America/Halifax,2025-10-16,"Halifax Regional Municipality - Garbage Collection (Bulky Waste)",https://www.halifax.ca/home-property/garbage-recycling-green-cart/garbage-collection,"Halifax 311",https://www.halifax.ca/home/311,"Varies by violation; illegal dumping complaints are investigated through Halifax 311.","Single-unit homes may set out one bulky item per garbage collection day; buildings with two to six units may set out two items. Items must weigh less than 200 kilograms and be shorter than eight feet. Appliances containing refrigerants require a CFC removal appointment and sticker before curbside collection.",mixed,"Set bulky items out after 7:00 p.m. the night before and by 7:00 a.m. on garbage day; remove any uncollected items by 9:00 p.m. the same day.",https://www.halifax.ca/home-property/garbage-recycling-green-cart/collection-schedules-what-goes-where,"Furniture such as sofas, chairs, tables, mattresses, and box springs|Large appliances and white goods with a CFC sticker if required|Large household toys","Household hazardous waste|Excess renovation or demolition debris|Appliances with refrigerants that have not been degassed|Items exceeding eight feet or 200 kilograms","Single-unit homes: one bulky item per collection. Buildings with two to six units: two bulky items per collection. Maximum weight 200 kilograms and maximum length eight feet.","Curbside bulky pickup is included in regular service. CFC removal for eligible appliances is free. Otter Lake drop-off charges $13.04 per 100 kilograms (plus tax) with a $5 minimum for loads under 100 kilograms.","Follow the address-specific calendar and service updates; collection begins at 7:00 a.m. and times may vary during holidays or severe weather.",https://www.halifax.ca/home-property/garbage-recycling-green-cart/illegal-dumping,"Set only one bulky item beside your garbage (two for small multi-unit buildings). For fridges and freezers, request the free CFC removal service, wait for the sticker, then set the appliance out on garbage day."
CA,Ontario,London,canada,ontario,london,America/Toronto,2025-10-16,"City of London - Curbside Garbage Collection (Large Furniture and Bulky Items)",https://london.ca/living-london/garbage-recycling/curbside-garbage-collection,"Service London",https://service.london.ca/,"Varies by municipal bylaw; enforcement handled by Municipal Compliance.","Large furniture or bulky items must be booked at least five business days before the next garbage day. Each booking covers up to four items with no annual cap or booking fee. Medium items within size limits can be set out without booking.",mixed,"Book online or by phone at least five business days before collection. Set items out by 7:00 a.m. on garbage day, no earlier than 6:00 p.m. the evening prior.",https://service.london.ca/report-garbage-issue/,"Couches and sofas|Mattresses and box springs (wrapped if required by pest guidance)|Large wooden furniture such as bookshelves|Other bulky household items that meet size rules","Appliances and electronics|Renovation or construction materials|Vehicle parts, batteries, or tires|Mostly metal items such as scrap metal furniture|Loose or improperly prepared items","Bulk bookings allow up to four items per collection day with at least five business days notice. Medium items without booking are limited to two cubic metres per collection.","There is no fee for bulky bookings. Drop-off fees may apply at EnviroDepots, such as appliance refrigerant removal or renovation material disposal charges.","During statutory holiday weeks, collection shifts forward one business day citywide. Confirm dates using the Collection Calendar.",https://service.london.ca/report-garbage-issue/,"Use the Service London portal to schedule up to four bulky items for your next garbage day. Do not set out appliances, electronics, or renovation debris; take those materials to an EnviroDepot."
CA,Ontario,Vaughan,canada,ontario,vaughan,America/Toronto,2025-10-16,"City of Vaughan - Garbage (Bulky Items) and Appliance Pickup",https://www.vaughan.ca/residential/garbage-and-recycling/garbage,"Access Vaughan",https://sv.vaughan.ca/en-US/submit-a-service-request/redirect/?id=b87b6ac4-7b25-e911-a980-000d3af3e521,"Varies by municipal bylaw; fines may apply for improper set-outs or illegal dumping.","Non-metal bulky items such as furniture and mattresses are collected on regular garbage days and count toward the three-item garbage limit. Appliances and metal items are collected by paid Thursday appointments. Multi-residential properties require property manager bookings.",mixed,"Set bulky garbage items at the curb by 7:00 a.m. on garbage day. Book appliance or metal pickup for Thursday service; set items out between 6:00 p.m. the night before and 7:00 a.m. on pickup day.",https://www.vaughan.ca/residential/garbage-and-recycling/appliance-and-metal-pick-residential,"Furniture and mattresses up to 68 kilograms|Toilets with tanks removed|Appliances or large metal items with a paid Thursday appointment|Large household toys","Electronics and e-waste|Household hazardous waste such as chemicals or propane cylinders|Construction or renovation materials including drywall or lumber|Liquid waste, automotive parts, or tires|Overweight, oversized, or unsafe items","Regular garbage limit is three items every other week; bulky items count as one item each. The City collects up to 13 items per location per day. Bulky items must weigh 68 kilograms or less. Multi-residential bulky service is provided through property manager appointments.","Regular curbside bulky collection is included in service. Appliance and metal pickup costs $39 per appliance, with additional administrative fees for late cancellations.","Holiday notices such as Canada Day, Christmas, or New Year's may shift collection by one day. Check the waste calendar and City updates.",https://sv.vaughan.ca/en-US/submit-a-service-request/redirect/?id=b87b6ac4-7b25-e911-a980-000d3af3e521,"On your garbage week, place large non-metal items at the curb by 7 a.m.; they count toward your three-item limit. Book and pay for Thursday appliance or metal pickup through Access Vaughan."
CA,Quebec,Longueuil,canada,quebec,longueuil,America/Toronto,2025-10-16,"Ville de Longueuil - Collecte des encombrants",https://longueuil.quebec/fr/encombrants,"Call 311 or 450-463-7311; submit service requests through the online citizen portal.",https://longueuil.quebec/fr/communiquez-avec-nous,"Varies by municipal bylaw; enforcement can issue fines for improper set-outs or illegal dumping.","Residential addresses receive one bulky collection per month by sector, except during the peak moving period. Set-out window is between 6:00 p.m. the evening before and 7:00 a.m. on collection day. Businesses and institutions are excluded.",curbside,"Follow the sector calendar for monthly bulky collection. Place items at the curb between 6:00 p.m. the night before and 7:00 a.m. on collection day; no appointment is required.",,"Upholstered furniture|Mattresses in protective bags|Carpets rolled and tied (roughly one metre per roll)|Large packing polystyrene tied together|Toilets|Stoves and other non-refrigerant appliances|Light fixtures|Garden hoses tied in bundles","Refrigeration or air-conditioning appliances that contain halocarbons|Tires|Garbage bags or loose trash|Wood or yard waste|Construction, renovation, or demolition debris|Soil, rocks, or stumps|Household hazardous waste|Electronics","Service is for residential properties only. Set items at the curb without blocking sidewalks or roads. Mattresses must be bagged, carpets and hoses must be tied, and items should not exceed practical bundle sizes. Refrigerant appliances and other excluded materials must be taken to ecocentres.","Included with municipal residential waste services. Ecocentre drop-off remains free within annual visit limits.","Holiday week adjustments are reflected in the sector calendar; check the interactive schedule before placing items at the curb.",https://longueuil.quebec/fr/communiquez-avec-nous,"Longueuil collects bulky items once per month by sector with no booking required. Check your calendar, place items out between 6 p.m. and 7 a.m., and bring excluded materials such as refrigerant appliances, electronics, or hazardous waste to an ecocentre."
CA,Quebec,Laval,canada,quebec,laval,America/Toronto,2025-10-16,"Ville de Laval - Encombrants",https://www.laval.ca/environnement/collectes/encombrants/,"Submit a report through Mon dossier or call 311 (450-978-8000 outside Laval).",https://mondossier.laval.ca/auth/requests/create?group=reports,"Waste management bylaw L-12424 sets fines from $200 to $1,000 for individuals and $400 to $2,000 for corporations.","Houses and buildings with up to 23 units receive bulky collection during one of the last two full weeks of each month by sector. Buildings with 24 or more units receive collection with regular garbage service. Refrigerant appliances are excluded and must go through the free GoRecycle program or an ecocentre.",curbside,"Set bulky items out after 7:00 p.m. the night before and before 7:00 a.m. on collection day at the edge of your property. Confirm your sector schedule online.",https://www.laval.ca/environnement/collectes/calendrier-collectes/,"Furniture such as sofas, chairs, tables, and dressers|Appliances without refrigerants including stoves, ovens, washers, and dryers|Drained water heaters|Carpets and rugs|Broken toys|Child car seats|Baths, showers, toilets, and sinks|Barbecues without propane tanks|Pool filters and parts that are emptied|Mattresses (bag if bedbugs are present)|Large branches, stumps, or trunks prepared per municipal guidelines","Refrigerant appliances such as refrigerators, freezers, portable air conditioners, dehumidifiers, or wine coolers|Household hazardous waste|Propane cylinders|Motor oil and automotive parts|Tires|Construction, renovation, or demolition debris|Items that exceed size or weight limits or are unsafe to handle","Maximum volume is two cubic metres per address per collection, with items no longer than 1.8 metres. Items must be movable by two people. Large branches must be cut and arranged neatly, with small twigs placed in the brown bin. Program covers residential properties only.","Curbside bulky collection is free. GoRecycle refrigerant appliance pickup is free, and ecocentre drop-off is free up to the annual allowance (12 cubic metres per address). Additional ecocentre volume costs $29 per cubic metre.","Collections generally operate on holidays except December 25 and January 1. Check the collection calendar for notices.",https://mondossier.laval.ca/auth/requests/create?group=reports,"Laval provides monthly bulky pickup by sector with a two cubic metre limit. Set items out after 7 p.m. and before 7 a.m., keep items manageable for a two-person crew, and use GoRecycle or the ecocentre for refrigerant appliances and excluded materials."
