country,region,city,country_slug,region_slug,city_slug,timezone,last_verified,source_title,source_url,complaint_channel,complaint_url,fine_range,notes_admin,service_type,schedule_pattern,request_url,eligible_items,not_accepted_items,limits,fees,holiday_shifts,illegal_dumping_reporting,notes_public
CA,Ontario,Brampton,canada,ontario,brampton,America/Toronto,2025-10-16,"Region of Peel - Bulky Items (Garbage)",https://peelregion.ca/waste/garbage/bulky,"Region of Peel Waste Management or Brampton 311",https://web.apps.peelregion.ca/waste/onlineservices,"Brampton refuse and dumping penalties range from $250 for a first offence to $750 for subsequent offences.","Brampton receives Region of Peel bulky service. Bulky items are collected free at the curb on garbage weeks, while appliances, electronics, and renovation materials must be taken to Community Recycling Centres.",curbside,"Set bulky items at the curb by 7:00 a.m. on garbage collection weeks and keep them about one metre from bins or obstacles.",https://peelregion.ca/waste/waste-collection-schedules/collection-calendar,"Furniture such as sofas, chairs, dressers, and bed frames|Mattresses and box springs|Barbecues with propane tanks removed|Carpet or underlay cut, rolled, and tied within size limits|Ceramic toilets with tank removed and a maximum of two per pickup","Large appliances including refrigerators or stoves|Electronics such as televisions and computers|Scrap metal items|Construction or renovation debris|Propane tanks or cylinders|Tires and rims|Household hazardous waste","Bulky items are collected only on garbage weeks. Place items by 7:00 a.m. with about one metre of clearance. Remove propane tanks from barbecues, separate toilet tanks and bowls, and tie carpet bundles within size limits.","Curbside bulky collection is free. Community Recycling Centre drop-off fees start at $7 per chargeable load, with dedicated loads of metals, electronics, and appliances accepted free. Payments are by debit or credit only.","Certain statutory holidays shift collection by one day. Confirm schedules through the Region's collection calendar.",https://web.apps.peelregion.ca/waste/onlineservices,"Place bulky items out on garbage weeks by 7 a.m. Keep items clear of bins, remove propane tanks from barbecues, and separate toilet components. Take appliances, electronics, and renovation debris to a Community Recycling Centre."
CA,Ontario,St. Catharines,canada,ontario,st-catharines,America/Toronto,2025-10-16,"Niagara Region - Large Item Collection",https://www.niagararegion.ca/waste/collection/items/large-items.aspx,"Niagara Region Waste Info-Line",https://www.niagararegion.ca/waste/,"Varies by violation.","Niagara Region provides large item collection. Book at least two business days before your garbage day. Up to four items per pickup for eligible houses and small apartment buildings.",appointment,"Submit an online or phone request at least two business days before your garbage day. Set items out after 5:00 p.m. the night before and by 7:00 a.m. on collection day.",https://www.niagararegion.ca/waste/collection/items/largeitems/request-form.aspx,"Furniture such as sofas, chairs, and tables|Mattresses and box springs|Carpet and underpadding rolled and tied|Two-piece toilets disassembled|Large plastic household items","Appliances and metal items|Household hazardous waste|Electronics|Construction or renovation debris","Book up to four items per collection. Eligible for houses and two- to six-unit buildings. Items placed before 5:00 p.m. the night prior may not be collected.","Large item pickup is included. Regional depots charge minimum and per-tonne fees with surcharges for items like refrigerant appliances or mattresses.","Most holidays do not change collection; confirm using the Niagara Region schedule or app.",https://www.niagararegion.ca/waste/contact/dumping/report-illegal-dumping.aspx,"Schedule Niagara Region large item pickup and place no more than four bulky items at the curb by 7 a.m. on garbage day. Appliances and metal items must go to a Regional drop-off depot."
CA,British Columbia,Victoria,canada,british-columbia,victoria,America/Vancouver,2025-10-16,"Capital Regional District - Hartland Landfill Public Drop-Off Depot",https://www.crd.ca/programs-services/garbage-recycling/hartland-landfill/public-drop-depot,"City of Victoria Bylaw Services or Public Works",https://www.victoria.ca/city-government/bylaw-services/report-bylaw-violation,"Varies by violation.","The City of Victoria does not operate curbside bulky pickup. Residents self-haul items to the CRD Hartland Landfill Public Drop-Off Depot or use private services.",dropoff,"Take bulky items to the Hartland Landfill Public Drop-Off Depot during posted hours (generally Monday through Saturday). Check current hours and rates before visiting.",https://www.crd.ca/programs-services/garbage-recycling/hartland-landfill/public-drop-depot,"Furniture and large household items|Mattresses and box springs|Large appliances including refrigerant units|Scrap metal and electronics|Yard and garden material","Materials banned under CRD rules|Demolition or renovation waste without approval|Explosives, biomedical, or radioactive materials","No routine curbside service. Follow Hartland load size limits and any permit requirements.","General refuse is charged by weight (e.g., $155 per tonne plus bin fee); many recyclables and hazardous materials are accepted at no charge.","Hartland hours and City collection schedules may change on statutory holidays; confirm before hauling.",https://www.victoria.ca/city-government/bylaw-services/report-bylaw-violation,"Victoria offers no bulky pickup-self-haul to Hartland. Many recyclables are free; general refuse is charged by weight. Report illegal dumping to Bylaw Services."
CA,Alberta,Edmonton (Metro),canada,alberta,edmonton-metro,America/Edmonton,2025-10-16,"City of Edmonton - Eco Stations and EWMC Disposal Rates",https://www.edmonton.ca/programs_services/garbage_waste/disposal-rates,"Edmonton 311 or local municipal service centres",https://www.edmonton.ca/programs_services/311-city-services,"Varies by municipality.","Most metro households use City of Edmonton Eco Stations or the Edmonton Waste Management Centre for bulky waste. Surrounding municipalities host seasonal large item events.",dropoff,"Eco Stations typically operate daily (8:00 a.m.---6:00 p.m.) and close on statutory holidays. EWMC keeps standard business hours. Seasonal Big Bin events have published dates.",https://www.edmonton.ca/programs_services/garbage_waste/eco-stations,"Bulky furniture and mattresses|Large appliances including refrigerant units|Electronics and household hazardous waste at Eco Stations|Scrap metal|Passenger or ATV tires within posted limits","Non-residential hazardous waste at Eco Stations|Biomedical or radioactive materials|Explosives or munitions|Certain restricted materials such as elm wood at Eco Stations","Eco Stations accept vehicles up to roughly one tonne with short trailers; larger loads use the EWMC. Municipal event pickups have local item and quantity caps.","EWMC residential disposal is typically $72 per tonne with a $20 minimum. Mattresses and refrigerant appliances have surcharges. Electronics and scrap metal are free at Eco Stations. Big Bin events are free.","Eco Stations close on statutory holidays; Big Bin events are seasonal and weather-dependent.",https://www.edmonton.ca/city_government/bylaws/illegal-dumping,"Drop bulky items at Eco Stations or the EWMC, watch for free Big Bin events, and check with your municipality for seasonal pickups. Report illegal dumping via 311."
US,Illinois,Chicago,united-states,illinois,chicago,America/Chicago,2025-10-16,"City of Chicago - Sanitation Code and Bulk Pick-Up Guidance",https://www.chicago.gov/city/en/depts/streets/provdrs/streets_san/svcs/sanitation_ordinance.html,"311 (web, app, or phone)",https://311.chicago.gov/s/?language=en_US,"Illegal dumping penalties range from $1,500 to $30,000, plus vehicle impound fees.","DSS collects bulky items for one- to four-unit residences. Residents place items next to refuse carts on garbage day or request 311 bulk/appliance pickup. Larger buildings hire private haulers.",mixed,"Place bulky items next to City refuse carts by 7:00 a.m. on your scheduled garbage day. For appliances or large piles, submit a 311 request or contact your ward superintendent.",https://311.chicago.gov/s/?language=en_US,"Furniture such as sofas, tables, chairs, and dressers|Mattresses and box springs sealed in plastic and labeled if infested|Other bulky items that do not fit in the refuse cart|Appliances (doors removed) scheduled via 311","Electronics (take to the HCCRF)|Household hazardous waste|Construction and demolition debris|Tires|Yard waste|Contractor or commercial waste","Do not block alleys or sidewalks. Refrigerators and freezers must have doors removed. Bed bug ordinance requires sealing and labeling infested items. Service applies only to one- to four-unit residences.","Bulk collection is included with regular service. Electronics and hazardous waste drop-off at HCCRF is free.","No service on City non-scheduled garbage holidays; collection shifts to the next business day for that week.",https://311.chicago.gov/s/?language=en_US,"Set bulky items by 7 a.m. on garbage day and request 311 service for appliances. Remove refrigerator doors, bag infested mattresses, and take electronics or hazardous waste to the City drop-off facility."
CA,Saskatchewan,Regina,canada,saskatchewan,regina,America/Regina,2025-10-16,"City of Regina - Landfill Information",https://www.regina.ca/home-property/recycling-garbage/landfill/,"Service Regina",https://www.regina.ca/about-regina/contact-us/service-request/,"Varies by bylaw.","Regina does not provide municipal bulky pickup. Residents self-haul to the City Landfill or hire a private hauler. Landfill rates and refrigerant fees are published online.",dropoff,"Deliver items during posted landfill hours (seasonal). Hazardous materials go to the Household Hazardous Materials Depot.",,"Furniture and household junk|Mattresses and box springs|Appliances (empty; refrigerant units incur surcharge)|Scrap metal and shingles|Standard municipal garbage or rubble","Wet loads or liquids|Household hazardous waste at the landfill|Electronics at the landfill|Explosives or firearms|Biohazardous or radioactive materials","Self-haul only. Loads up to 200 kg pay the small-load rate; heavier loads charged by weight. Loads must be tarped and secured. Refrigerant appliances incur an extra fee.","Standard waste: $10 (<=200 kg) or $95/tonne; refrigerant removal $10 per appliance plus disposal fees. Payment accepted at the scale house.","Landfill hours vary seasonally and on holidays; check the City website for updates.",https://www.regina.ca/about-regina/contact-us/service-request/,"Regina has no curbside bulky pickup-take sofas, mattresses, and appliances to the City Landfill or hire a hauler. Use the HHM Depot for hazardous items and SARCAN for electronics."
CA,British Columbia,Surrey,canada,british-columbia,surrey,America/Vancouver,2025-10-16,"City of Surrey - Large Item Pickup Program",https://www.surrey.ca/services-payments/waste-collection/large-item-pickup-program,"City of Surrey Waste Collection Services",https://www.surrey.ca/services-payments/waste-collection/missed-collection,"Illegal dumping fines up to $10,000; unscheduled set-outs may receive bylaw notices.","Surrey offers free on-call large item pickup. Houses can schedule six items per year (eight with a registered secondary suite); apartments/condos participate via property managers.",appointment,"Book online or by phone and place items at the designated spot by 7:30 a.m. on the scheduled day. Leave items accessible until 7:30 p.m.",https://my.surrey.ca/largeitems/terms,"Furniture such as sofas, tables, and dressers|Bagged mattresses and box springs|Large appliances (fridges, stoves, washers, dryers)|Electronics and boxed small appliances|Exercise equipment and outdoor furniture without propane tanks","Bathtubs or sinks|Carpets and rugs|Construction or renovation debris|Large glass or mirrors (remove and self-haul)|Propane tanks|Hot tubs or fireplaces","Up to six items per household per year (eight with a registered secondary suite). Apartments/condos: up to four items per unit per year via property managers. Mattresses must be bagged in clear plastic.","Large item pickup is free within annual limits. Self-haul fees follow Metro Vancouver rates.","Most holidays are serviced except December 25 and January 1; bookings on those dates are rescheduled.",https://www.surrey.ca/services-payments/waste-collection/missed-collection,"Book Surrey's free large item pickup, bag mattresses, remove propane tanks, and keep items accessible for collection from 7:30 a.m. to 7:30 p.m."
CA,Ontario,Richmond Hill,canada,ontario,richmond-hill,America/Toronto,2025-10-16,"City of Richmond Hill - Garbage and Recycling at Your Home",https://www.richmondhill.ca/en/living-here/Garbage-and-Recycling-at-Your-Home.aspx,"Access Richmond Hill Contact Centre",https://accessrh.richmondhill.ca,"Illegal dumping fines up to $5,000; smaller penalties for other waste bylaw offences.","Richmond Hill collects bulky items with garbage every other week. Each bulky item counts toward the three-item garbage limit. Appliances and metal items require a separate appointment.",mixed,"Set bulky items out on your garbage day by 7:00 a.m. (6:00 a.m. in the downtown core) and no earlier than 6:00 p.m. the night before. Garbage is every other week.",https://eservices.richmondhill.ca/garbagecollection/,"Couches and sofas|Chairs|Mattresses and box springs|Toilets with separated tanks and bowls unless one-piece|Dressers and other non-metal furniture|Wrapped and labeled glass or mirrors","Appliances and metal items on regular garbage day|Construction or renovation debris|Electronics|Household hazardous waste|Tires|Medical sharps or medications","Three garbage items per collection, with each bulky item counting as one. Maximum weight 68 kg and length six feet. Remove uncollected material by 9:00 p.m.","Bulky collection is included. Appliances and metal items are collected monthly by free appointment. Garbage tags for additional items cost extra; regional depots may charge for certain drop-offs.","If a statutory holiday (except Boxing Day) falls on a collection day, service shifts one day later that week.",https://accessrh.richmondhill.ca,"Set bulky items out on garbage day within the three-item limit, book appliance or metal pickups separately, wrap and label glass, and take electronics or hazardous items to York Region depots."
CA,Ontario,Oakville,canada,ontario,oakville,America/Toronto,2025-10-16,"Halton Region - Curbside Collection and Waste Sorting Guide",https://www.halton.ca/for-residents/recycling-waste/curbside-collection-and-waste-sorting-guide,"Halton 311 (Access Halton)",https://www.halton.ca/the-region/contact-us/about-311,"Varies by bylaw violation.","Halton Region collects bulky waste every other week on garbage day with a three-item limit. Items must be set out by 7:00 a.m. and not earlier than 5:00 p.m. the evening before. Metal items and appliances require appointments.",mixed,"Bulk items: every other week on garbage day; set out by 7:00 a.m. and no earlier than 5:00 p.m. the previous evening. Metal and appliances: schedule a free appointment before setting out.",https://www.halton.ca/for-residents/recycling-waste/recycling-and-waste-tools/online-waste-collection-schedule,"Furniture such as sofas, chairs, and tables|Mattresses and box springs wrapped and sealed in plastic|Carpet and underpadding bundled to 1.2 meters by 0.76 meters|Toilets with tanks separated|Wood items including fencing or shelving bundled to 1.2 meters by 0.76 meters|Windows or mirrors taped in an X pattern","Household hazardous waste|Tires and auto parts|Propane tanks|Construction and demolition debris|Concrete and bricks|Electronics","Set out no more than three bulky items per collection. Items that fit in a closed bag or container are not considered bulk.","Curbside bulky pickup is included. Metal and appliance pickup is free by appointment. Tipping fees apply at the Halton Waste Management Site.","Holiday weeks may alter collection schedules; confirm via the Online Waste Collection Schedule.",https://oakvillecrm.my.site.com/ServiceOakville/s/select-a-request,"Place up to three bulky items next to your garbage by 7 a.m. on garbage weeks. Book metal or appliance pickups in advance or use the Halton Waste Management Site for special items."
CA,Ontario,Burlington,canada,ontario,burlington,America/Toronto,2025-10-16,"Halton Region - Curbside Collection and Waste Sorting Guide",https://www.halton.ca/for-residents/recycling-waste/curbside-collection-and-waste-sorting-guide,"Halton 311 (Access Halton)",https://www.halton.ca/the-region/contact-us/about-311,"Varies by bylaw violation.","Halton Region collects bulky items every other week with a three-item limit. Metal items and appliances must be booked separately through the Region's appointment service.",mixed,"Bulk items: every other week on garbage day by 7:00 a.m., not earlier than 5:00 p.m. the evening before. Metal and appliances: booked appointment required.",https://www.halton.ca/for-residents/recycling-waste/recycling-and-waste-tools/metal-and-appliance-collection,"Furniture including tables, sofas, and chairs|Mattresses and box springs wrapped and sealed in plastic|Carpet and underpadding bundled to 1.2 meters by 0.76 meters|Disassembled toilets|Wood items bundled to 1.2 meters by 0.76 meters|Windows or mirrors taped before set-out","Household hazardous waste|Tires and auto parts|Propane tanks|Construction and demolition debris|Concrete and bricks|Electronics","Set out a maximum of three bulky items per collection. Do not pile items; only loose oversized items count as bulk.","Curbside bulky collection is included in base service. Metal and appliance pickups are free by appointment. Halton Waste Management Site charges tipping fees for certain drop-offs.","Holiday weeks may shift collection schedules; use the online waste collection tools to confirm.",https://www.burlington.ca/en/home-property-and-environment/litter-and-clean-ups.aspx,"Set out up to three bulky items on your garbage week by 7 a.m. Wrap mattresses, bundle materials to size, and pre-book free metal or appliance pickups."
CA,British Columbia,Richmond,canada,british-columbia,richmond-bc,America/Vancouver,2025-10-16,"City of Richmond - Large Item Pick Up",https://www.richmond.ca/services/recycling-garbage/garbagecollection/largeitem.htm,"City of Richmond Environmental Programs",https://www.richmond.ca/services/recycling-garbage/garbagecollection.htm,"Illegal dumping fines can reach $1,000.","Eligible residents may book up to six large item pickups per year through the City's contractor. Some strata properties are ineligible and must arrange alternative disposal.",appointment,"Schedule through Sierra Waste by 4:00 p.m. the Thursday before the next garbage day. Set items out after 8:00 p.m. the night before or by 7:30 a.m. on pickup day.",https://richmond.ca/services/recycling-garbage/garbagecollection/largeitem/schedulepickup.htm,"Appliances such as stoves, washers, dryers, and refrigerators (propane removed)|Furniture including sofas and upholstered items that are dry|Mattresses and box springs wrapped and sealed in plastic|Bed frames and headboards|Outdoor furniture|Small household goods packaged in boxes or bundles counted as one item|Electric lawnmowers|Passenger or light-duty tires|Weight-training equipment","Wet or unsealed mattresses and upholstered furniture|Propane tanks|Gas lawnmowers|Automobile bodies and parts|Tree stumps|Carpets and lumber|Demolition or renovation debris|Hazardous waste","Six large items per address per calendar year. Items must be dry, manageable, and accessible from the curb.","Service is included for eligible addresses. Additional items must be taken to disposal facilities at the resident's cost.","Consult the City calendar and appointment confirmation for holiday changes.",https://www.richmond.ca/services/recycling-garbage/garbagecollection/Dumping.htm,"Book up to six large item pickups per year through the City. Set items out after 8 p.m. before pickup day, wrap mattresses, and keep upholstered furniture dry."
CA,British Columbia,Burnaby,canada,british-columbia,burnaby,America/Vancouver,2025-10-16,"City of Burnaby - Large Item Pickup",https://www.burnaby.ca/services-and-payments/recycling-and-garbage/large-item-pickup,"Solid Waste and Recycling Division",https://www.burnaby.ca/services-and-payments/recycling-and-garbage,"Varies by municipal enforcement; illegal dumping penalties may apply.","Burnaby offers free on-call large item pickup for households with City curbside collection. Houses and duplexes may set out up to three items per pickup; multi-family complexes up to six items per appointment.",appointment,"Submit a request online or call 604-294-7972. After receiving the confirmed date and location, set items out at the specified spot before the scheduled time.",https://www.burnaby.ca/services-and-payments/recycling-and-garbage/large-item-pickup/large-item-pickup-request-form,"Large kitchen and laundry appliances|Hot water tanks|Air conditioners|Large standing barbecues with propane tanks removed|Patio furniture (excluding umbrellas)|Bed frames and box springs|Stand-alone cabinets, shelves, and nightstands|Small area rugs under five feet|Dressers, desks, tables, and entertainment units|Chairs, couches, sofas, ottomans, and recliners|Baby cribs|Toilets|Mattresses thicker than four inches wrapped and sealed in plastic|Mirrors wrapped for safety","Televisions, computers, and electronics|Microwaves and lamps|Construction, renovation, or demolition materials|Loose doors|Baby car seats|Suitcases or luggage|Mattress toppers|Patio umbrellas|Fireplaces or fire tables|Game tables|Children's toys","Houses and duplexes can place three items per pickup. Multi-family complexes can place six items per appointment and must use the designated setout location. Mattresses must be wrapped and mirrors must be protected.","No cost for eligible City customers.",,"Report issues to Solid Waste and Recycling at 604-294-7972 or through the BurnabyConnect app.","Burnaby's large item pickup is by appointment. Schedule online or by phone, follow the City's setout instructions, wrap mattresses, and use other disposal options for electronics or renovation debris."
CA,Quebec,Gatineau,canada,quebec,gatineau,America/Toronto,2025-10-16,"Ville de Gatineau - Encombrants",https://www.gatineau.ca/portail/default.aspx?c=en-CA&p=guichet_municipal/ordures_recyclage_compostage_encombrants/encombrants_residus_construction,"Gatineau 311",https://www.gatineau.ca/portail/default.aspx?c=en-CA&p=pour_nous_joindre/centre_appels_non_urgents/enregistrer_requete,"Nuisances and residual materials bylaws levy fines from $300 to $1,000 for individuals and $600 to $2,000 for legal persons.","Bulky collections are scheduled through the DTRITUS app with up to 18 dates per year. Residents can book four items per request, or up to twelve for multi-residential properties. Items must be categorized correctly and placed at the curb within the allowed timeframe.",appointment,"Book through DTRITUS. Set items out after 7:00 p.m. the night before or before 7:00 a.m. on collection day at the edge of your property.",https://www.gatineau.ca/dtritus,"Furniture such as sofas, tables, chairs, and dressers|Mattresses and box springs|Wood or metal items including bed frames and interior doors|Non-refrigerant appliances such as stoves, dishwashers, washers, and dryers|Large household toys or other oversized items|Refrigerant appliances collected separately through the GoRecycle program","Toilets|Household hazardous waste|Propane tanks and pressurized cylinders|Construction, renovation, or demolition debris|Electronics|Items not registered in DTRITUS or unsafe for collection","Book up to four items per appointment or twelve for multi-residential properties. Items must be placed at the curb after 7:00 p.m. before collection day and before 7:00 a.m. on collection day, keeping sidewalks clear.","Curbside bulky pickups are free. Refrigerant appliance pickups are free via GoRecycle. Ecocentre drop-off fees depend on material type and quantity.","Collections do not occur on December 25 or January 1 and shift by one day during those weeks; check DTRITUS for updates.",https://www.gatineau.ca/portail/default.aspx?c=en-CA&p=pour_nous_joindre/centre_appels_non_urgents/enregistrer_requete,"Schedule bulky pickups through the DTRITUS app. Register each item, set them out between 7 p.m. and 7 a.m., and use GoRecycle or ecocentres for excluded materials such as toilets or refrigerant appliances."
